{
  "$defs": {
    "metadata": {
      "additionalProperties": false,
      "type": "object",
      "required": [
        "version",
        "domain",
        "user_id",
        "received_at",
        "source"
      ],
      "properties": {
        "domain": {
          "type": "string"
        },
        "received_at": {
          "type": "string",
          "format": "date-time"
        },
        "version": {
          "type": "string",
          "const": "v1"
        },
        "source": {
          "additionalProperties": true,
          "type": "object",
          "required": [
            "provider"
          ],
          "properties": {
            "delivery_id": {
              "type": "string"
            },
            "provider": {
              "type": "string"
            },
            "event_id": {
              "type": "string"
            }
          }
        },
        "user_id": {
          "type": "string",
          "minLength": 1
        }
      }
    }
  },
  "required": [
    "version",
    "domain",
    "user_id",
    "received_at",
    "source",
    "session_id",
    "start_time",
    "end_time"
  ],
  "$schema": "http://json-schema.org/draft-07/schema#",
  "$id": "https://athlete-ally.dev/schemas/normalized/fitness_session.v1.json",
  "title": "Normalized fitness_session v1",
  "additionalProperties": false,
  "type": "object",
  "properties": {
    "version": {
      "type": "string",
      "const": "v1"
    },
    "user_id": {
      "type": "string"
    },
    "received_at": {
      "type": "string",
      "format": "date-time"
    },
    "source": {
      "$ref": "#/$defs/metadata/properties/source"
    },
    "activity_type": {
      "type": "string"
    },
    "start_time": {
      "type": "string",
      "format": "date-time"
    },
    "domain": {
      "type": "string",
      "const": "fitness_session"
    },
    "session_id": {
      "type": "string"
    },
    "end_time": {
      "type": "string",
      "format": "date-time"
    },
    "distance_m": {
      "type": "number",
      "minimum": 0
    },
    "calories_kcal": {
      "type": "number",
      "minimum": 0
    },
    "heart_rate_summary": {
      "additionalProperties": false,
      "type": "object",
      "properties": {
        "min": {
          "type": "number",
          "minimum": 0
        },
        "max": {
          "type": "number",
          "minimum": 0
        },
        "avg": {
          "type": "number",
          "minimum": 0
        }
      }
    }
  }
}
