{
  "version": "v1",
  "domain": "fitness_session",
  "user_id": "user-123",
  "received_at": "2025-09-27T12:34:56Z",
  "source": {
    "provider": "garmin",
    "event_id": "evt-5",
    "delivery_id": "del-5"
  },
  "session_id": "sess-2025-09-27-1",
  "start_time": "2025-09-27T07:30:00Z",
  "end_time": "2025-09-27T08:15:00Z",
  "activity_type": "running",
  "calories_kcal": 520,
  "distance_m": 7000,
  "heart_rate_summary": { "min": 95, "max": 175, "avg": 148 }
}
